{"schema_version":"1.0.0","project_id":"novel_example","state_version":"0.1.0","as_of_episode":0,"characters":[{"character_id":"protagonist","location":"archive","current_goal":"hide the altered ledger","emotional_state":"controlled anxiety","injuries":[],"knowledge":["one page was replaced"],"secrets":["kept the original page"],"inventory":["original ledger page"],"last_evidence":{"episode":0,"source_id":"story_bible:character-protagonist"}},{"character_id":"inspector","location":"archive","current_goal":"find the accounting discrepancy","emotional_state":"suspicious","injuries":[],"knowledge":["the totals do not match"],"secrets":[],"inventory":[],"last_evidence":{"episode":0,"source_id":"story_bible:character-inspector"}},{"character_id":"clerk","location":"archive","current_goal":"avoid blame","emotional_state":"fearful","injuries":[],"knowledge":["the inspector arrived early"],"secrets":["saw the protagonist take a page"],"inventory":[],"last_evidence":{"episode":0,"source_id":"story_bible:character-clerk"}}]}
